DANE_ORYGINALNE;WYNIK_AI
﻿Name;PKD_2007;PKD_2007_all;description_PL;description_EN;source;BRAK OPISU
NULL;3032;NULL;produkcją wiropłatów o ruchomych silnikach typu tiltrotor dla wojska.;NULL;Dane_syntetyczne_1;Branża: Wojsko | Produkty: Wiropłat o ruchomych silnikach typu tiltrotor | Usługi: Brak
NULL;3032;NULL;produkcją dronów do celów wojskowych (UAV).;NULL;Dane_syntetyczne_1;Branża: Wojsko | Produkty: Drony (UAV) | Usługi: Brak
NULL;3032;NULL;remontami fabrycznymi wojskowych statków powietrznych.;NULL;Dane_syntetyczne_1;Branża: Przemysł wojskowy | Produkty: remonty fabryczne statków powietrznych | Usługi: brak
NULL;3032;NULL;przebudową fabryczną wojskowych statków kosmicznych.;NULL;Dane_syntetyczne_1;Branża: Przemysł kosmiczny | Produkty: Statki kosmiczne | Usługi: BRAK OPISU
NULL;3032;NULL;produkcją siedzeń do wojskowych statków powietrznych.;NULL;Dane_syntetyczne_1;Branża: Przemysł lotniczy | Produkty: Produkcja siedzeń do wojskowych statków powietrznych | Usługi: Brak
